Author,Title,Year,Category,Url,Citations"Pettit, Raymond and Homer, John and Gee, Roger and Mengel, Susan and Starbuck, Adam",An Empirical Study of Iterative Improvement in Programming Assignments,2015,LA: assessment: automatic tutoring and assessment systems,http://doi.acm.org/10.1145/2676723.2677279,4"Denny, Paul",Generating Practice Questions As a Preparation Strategy for Introductory Programming Exams,2015,LA: assessment: exams,http://doi.acm.org/10.1145/2676723.2677253,3"VanDeGrift, Tammy",Supporting Creativity and User Interaction in CS 1 Homework Assignments,2015,LA: assessment: other: homework and quizzes,http://doi.acm.org/10.1145/2676723.2677250,3"Wood, Zo\""{e} and Keen, Aaron",Building Worlds: Bridging Imperative-First and Object-Oriented Programming in CS1-CS2,2015,LA: assessment: other: projects,http://doi.acm.org/10.1145/2676723.2677249,0"Pokorny, Kian L.",Creating a Computer Simulator As a CS1 Student Project,2015,LA: assessment: other: projects,http://doi.acm.org/10.1145/2676723.2677210,1"Wittman, Barry and Pretz, Jean","Bats, Balls, and Lures: Cognitive Style in CS Education",2015,LA: learning: conceptual or cognitive issues (load - mental models - notional machines),http://doi.acm.org/10.1145/2676723.2677291,0"Keen, Aaron and Mammen, Kurt",Program Decomposition and Complexity in CS1,2015,LA: learning: learning styles,http://doi.acm.org/10.1145/2676723.2677219,2"Vihavainen, Arto and Miller, Craig S. and Settle, Amber",Benefits of Self-explanation in Introductory Programming,2015,LA: learning: other,http://doi.acm.org/10.1145/2676723.2677260,1"Sudol-DeLyser, Leigh Ann",Expression of Abstraction: Self Explanation in Code Production,2015,LA: learning: reading or writing or tracing or debugging or testing,http://doi.acm.org/10.1145/2676723.2677222,0"Ginat, David and Menashe, Eti",SOLO Taxonomy for Assessing Novices' Algorithmic Design,2015,LA: learning: reading or writing or tracing or debugging or testing,http://doi.acm.org/10.1145/2676723.2677311,3"Norman, Victor T. and Adams, Joel C.",Improving Non-CS Major Performance in CS1,2015,Students: non-majors,http://doi.acm.org/10.1145/2676723.2677214,1"Baldwin, Douglas","Can We ""Flip"" Non-Major Programming Courses Yet?",2015,Students: non-majors,http://doi.acm.org/10.1145/2676723.2677271,3"Settle, Amber and Lalor, John and Steinbach, Theresa",Reconsidering the Impact of CS1 on Novice Attitudes,2015,Students: other: (attitudes self-efficacy at-risk),http://doi.acm.org/10.1145/2676723.2677235,5"Carter, Jason and Dewan, Prasun and Pichiliani, Mauro",Towards Incremental Separation of Surmountable and Insurmountable Programming Difficulties,2015,Students: predicting and measuring success,http://doi.acm.org/10.1145/2676723.2677294,9"Altadmri, Amjad and Brown, Neil C.C.",37 Million Compilations: Investigating Novice Programming Mistakes in Large-Scale Student Data,2015,Students: predicting and measuring success: programming process data,http://doi.acm.org/10.1145/2676723.2677258,29"Spacco, Jaime and Denny, Paul and Richards, Brad and Babcock, David and Hovemeyer, David and Moscola, James and Duvall, Robert",Analyzing Student Work Patterns Using Programming Exercise Data,2015,Students: predicting and measuring success: programming process data,http://doi.acm.org/10.1145/2676723.2677297,13"Horton, Diane and Craig, Michelle","Drop, Fail, Pass, Continue: Persistence in CS1 and Beyond in Traditional and Inverted Delivery",2015,Students: retention,http://doi.acm.org/10.1145/2676723.2677273,12"Latulipe, Celine and Long, N. Bruce and Seminario, Carlos E.",Structuring Flipped Classes with Lightweight Teams and Gamification,2015,Teaching: flipped approaches,http://doi.acm.org/10.1145/2676723.2677240,12"Lacher, Lisa L. and Lewis, Mark C.",The Effectiveness of Video Quizzes in a Flipped Class,2015,Teaching: flipped approaches,http://doi.acm.org/10.1145/2676723.2677302,5"Blaheta, Don",Unci: A C++-based Unit-testing Framework for Intro Students,2015,Tools: debugging and testing,http://doi.acm.org/10.1145/2676723.2677228,0"Gaspar, Alessio and Torsella, Joni and Honken, Nora and Sohoni, Sohum and Arnold, Colin",Differences in the Learning Principles Dominating Student-Student vs. Student-Instructor Interactions While Working on Programming Tasks,2016,CA: other,http://doi.acm.org/10.1145/2839509.2844627,1"Eck, Adam and Soh, Leen-Kiat and Shell, Duane F.",Investigating Differences in Wiki-based Collaborative Activities Between Student Engagement Profiles in CS1,2016,CA: other: collaborative tools,http://doi.acm.org/10.1145/2839509.2844615,0"McChesney, Ian",Three Years of Student Pair Programming: Action Research Insights and Outcomes,2016,CA: pair programming,http://doi.acm.org/10.1145/2839509.2844565,3"Porter, Leo and Bouvier, Dennis and Cutts, Quintin and Grissom, Scott and Lee, Cynthia and McCartney, Robert and Zingaro, Daniel and Simon, Beth",A Multi-institutional Study of Peer Instruction in Introductory Computing,2016,CA: peer instruction,http://doi.acm.org/10.1145/2839509.2844642,7"Horton, Diane and Campbell, Jennifer and Craig, Michelle","Online CS1: Who Enrols, Why, and How Do They Do?",2016,"DSA PS: online, remote or MOOC delivery, DSA PS: online remote or MOOC delivery",http://doi.acm.org/10.1145/2839509.2844578,2"Marling, Cindy and Juedes, David",CS0 for Computer Science Majors at Ohio University,2016,DSA: How CS1 relates to CS0 or CS2,http://doi.acm.org/10.1145/2839509.2844624,3"Wiegand, R. Paul and Bucci, Anthony and Kumar, Amruth N. and Albert, Jennifer L. and Gaspar, Alessio",A Data-Driven Analysis of Informatively Hard Concepts in Introductory Programming,2016,LA: learning: conceptual or cognitive issues (load - mental models - notional machines),http://doi.acm.org/10.1145/2839509.2844629,1"Becker, Brett A.",An Effective Approach to Enhancing Compiler Error Messages,2016,LA: learning: errors,http://doi.acm.org/10.1145/2839509.2844584,11"Ahadi, Alireza and Behbood, Vahid and Vihavainen, Arto and Prior, Julia and Lister, Raymond",Students' Syntactic Mistakes in Writing Seven Different Types of SQL Queries and Its Application to Predicting Students' Success,2016,LA: learning: errors,http://doi.acm.org/10.1145/2839509.2844640,7"Castro, Francisco Enrique Vicente and Fisler, Kathi",On the Interplay Between Bottom-Up and Datatype-Driven Program Design,2016,LA: learning: learning styles,http://doi.acm.org/10.1145/2839509.2844574,3"Pachulski Camara, Bruno Henrique and Graciotto Silva, Marco Aur{\'e}lio",A Strategy to Combine Test-Driven Development and Test Criteria to Improve Learning of Programming Skills,2016,LA: learning: reading or writing or tracing or debugging or testing,http://doi.acm.org/10.1145/2839509.2844633,2"Sahami, Mehran and Piech, Chris","As CS Enrollments Grow, Are We Attracting Weaker Students?",2016,Students: other: enrollment issues,http://doi.acm.org/10.1145/2839509.2844621,4"Leinonen, Juho and Longi, Krista and Klami, Arto and Vihavainen, Arto",Automatic Inference of Programming Performance and Experience from Typing Patterns,2016,Students: predicting and measuring success,http://doi.acm.org/10.1145/2839509.2844612,8"Lishinski, Alex and Yadav, Aman and Enbody, Richard and Good, Jon",The Influence of Problem Solving Abilities on Students' Performance on Different Assessment Tasks in CS1,2016,Students: predicting and measuring success,http://doi.acm.org/10.1145/2839509.2844596,1"Caceffo, Ricardo and Wolfman, Steve and Booth, Kellogg S. and Azevedo, Rodolfo",Developing a Computer Science Concept Inventory for Introductory Programming,2016,Students: prior knowledge: concept inventories; geek genes; misconceptions,http://doi.acm.org/10.1145/2839509.2844559,7"Shell, Duane F. and Soh, Leen-Kiat and Flanigan, Abraham E. and Peteranetz, Markeya S.",Students' Initial Course Motivation and Their Achievement and Retention in College CS1 Courses,2016,Students: retention,http://doi.acm.org/10.1145/2839509.2844606,6"Maxwell, Bruce A. and Taylor, Stephanie R.",Comparing Outcomes Across Different Contexts in CS1,2017,Content: other: CS+X,http://doi.acm.org/10.1145/3017680.3017757,1"Fitzpatrick, J. Michael and L{\'e}deczi, \'{A}kos and Narasimham, Gayathri and Lafferty, Lee and Labrie, R{\'e}al and Mielke, Paul T. and Kumar, Aatish and Brady, Katherine A.",Lessons Learned in the Design and Delivery of an Introductory Programming MOOC,2017,"DSA PS: online, remote or MOOC delivery, DSA PS: online remote or MOOC delivery",http://doi.acm.org/10.1145/3017680.3017730,1"Price, Thomas W. and Dong, Yihuan and Lipovac, Dragan",iSnap: Towards Intelligent Tutoring in Novice Programming Environments,2017,LA: assessment: automatic tutoring and assessment systems,http://doi.acm.org/10.1145/3017680.3017762,4"Cheng, Nick and Harrington, Brian",The Code Mangler: Evaluating Coding Ability Without Writing Any Code,2017,LA: assessment: exams,http://doi.acm.org/10.1145/3017680.3017704,4"Cao, Yingjun and Porter, Leo",Evaluating Student Learning from Collaborative Group Tests in Introductory Computing,2017,LA: assessment: exams,http://doi.acm.org/10.1145/3017680.3017729,6"Lovellette, Ellie and Matta, John and Bouvier, Dennis and Frye, Roger",Just the Numbers: An Investigation of Contextualization of Problems for Novice Programmers,2017,LA: assessment: general,http://doi.acm.org/10.1145/3017680.3017726,1"Pettit, Raymond S. and Homer, John and Gee, Roger",Do Enhanced Compiler Error Messages Help Students?: Results Inconclusive.,2017,LA: learning: errors,http://doi.acm.org/10.1145/3017680.3017768,3"Alqadi, Basma S. and Maletic, Jonathan I.",An Empirical Study of Debugging Patterns Among Novices Programmers,2017,LA: learning: reading or writing or tracing or debugging or testing,http://doi.acm.org/10.1145/3017680.3017761,2"Babes-Vroman, Monica and Juniewicz, Isabel and Lucarelli, Bruno and Fox, Nicole and Nguyen, Thu and Tjang, Andrew and Haldeman, Georgiana and Mehta, Ashni and Chokshi, Risham",Exploring Gender Diversity in CS at a Large Public R1 Research University,2017,Students: gender diversity inclusion accessibililty,http://doi.acm.org/10.1145/3017680.3017773,3"Sax, Linda J. and Lehman, Kathleen J. and Zavala, Christina",Examining the Enrollment Growth: Non-CS Majors in CS1 Courses,2017,Students: non-majors,http://doi.acm.org/10.1145/3017680.3017781,1"Castro-Wunsch, Karo and Ahadi, Alireza and Petersen, Andrew",Evaluating Neural Networks As a Method for Identifying Students in Need of Assistance,2017,Students: other: (attitudes self-efficacy at-risk),http://doi.acm.org/10.1145/3017680.3017792,1"Khosravi, Hassan and Cooper, Kendra M.L.",Using Learning Analytics to Investigate Patterns of Performance and Engagement in Large Classes,2017,Students: predicting and measuring success,http://doi.acm.org/10.1145/3017680.3017711,3"Estey, Anthony and Keuning, Hieke and Coady, Yvonne",Automatically Classifying Students in Need of Support by Detecting Changes in Programming Behaviour,2017,Students: predicting and measuring success: programming process data,http://doi.acm.org/10.1145/3017680.3017790,4"Kirkpatrick, Michael S. and Mayfield, Chris",Evaluating an Alternative CS1 for Students with Prior Programming Experience,2017,Students: prior knowledge,http://doi.acm.org/10.1145/3017680.3017759,5"Kohn, Tobias",Variable Evaluation: An Exploration of Novice Programmers' Understanding and Common Misconceptions,2017,Students: prior knowledge: concept inventories; geek genes; misconceptions,http://doi.acm.org/10.1145/3017680.3017724,2"Edgcomb, Alex and Vahid, Frank and Lysecky, Roman and Lysecky, Susan","Getting Students to Earnestly Do Reading, Studying, and Homework in an Introductory Programming Class",2017,Teaching: other,http://doi.acm.org/10.1145/3017680.3017732,1"Shell, Duane F. and Soh, Leen-Kiat and Flanigan, Abraham E. and Peteranetz, Markeya S. and Ingraham, Elizabeth",Improving Students' Learning and Achievement in CS Classrooms Through Computational Creativity Exercises That Integrate Computational and Creative Thinking,2017,Teaching: other: computational thinking,http://doi.acm.org/10.1145/3017680.3017718,1"Schreiber, Benjamin J. and Dougherty, John P.",Assessment of Introducing Algorithms with Video Lectures and Pseudocode Rhymed to a Melody,2017,Teaching: video,http://doi.acm.org/10.1145/3017680.3017789,1"Battestilli, Lina and Awasthi, Apeksha and Cao, Yingjun",Two-Stage Programming Projects: Individual Work Followed by Peer Collaboration,2018,CA: other,http://doi.acm.org/10.1145/3159450.3159486,0"Celepkolu, Mehmet and Boyer, Kristy Elizabeth",Thematic Analysis of Students' Reflections on Pair Programming in CS1,2018,CA: pair programming,http://doi.acm.org/10.1145/3159450.3159516,0"Aarne, Onni and Peltola, Petrus and Leinonen, Juho and Hellas, Arto",A Study of Pair Programming Enjoyment and Attendance Using Study Motivation and Strategy Metrics,2018,CA: pair programming,http://doi.acm.org/10.1145/3159450.3159493,0"Celepkolu, Mehmet and Boyer, Kristy Elizabeth",The Importance of Producing Shared Code Through Pair Programming,2018,CA: pair programming,http://doi.acm.org/10.1145/3159450.3159506,0"Crawford, Chris S. and Gardner-McCune, Christina and Gilbert, Juan E.",Brain-Computer Interface for Novice Programmers,2018,Content: other: CS+X,http://doi.acm.org/10.1145/3159450.3159603,0"Berger-Wolf, Tanya and Igic, Boris and Taylor, Cynthia and Sloan, Robert and Poretsky, Rachel","A Biology-themed Introductory CS Course at a Large, Diverse Public University",2018,Content: other: CS+X,http://doi.acm.org/10.1145/3159450.3159538,0"Dahlby Albright, Sarah and Klinge, Titus H. and Rebelsky, Samuel A.",A Functional Approach to Data Science in CS1,2018,Content: other: data science approach,http://doi.acm.org/10.1145/3159450.3159550,0"Ilves, Kalle and Leinonen, Juho and Hellas, Arto",Supporting Self-Regulated Learning with Visualizations in Online Learning Environments,2018,"DSA PS: online, remote or MOOC delivery, DSA PS: online remote or MOOC delivery",http://doi.acm.org/10.1145/3159450.3159509,0"Wood, Zo\""{e} J. and Clements, John and Peterson, Zachary and Janzen, David and Smith, Hugh and Haungs, Michael and Workman, Julie and Bellardo, John and DeBruhl, Bruce",Mixed Approaches to CS0: Exploring Topic and Pedagogy Variance After Six Years of CS0,2018,DSA: How CS1 relates to CS0 or CS2,http://doi.acm.org/10.1145/3159450.3159592,0"Xu, Dianna and Wolz, Ursula and Kumar, Deepak and Greenburg, Ira",Updating Introductory Computer Science with Creative Computation,2018,DSA: How CS1 relates to CS0 or CS2,http://doi.acm.org/10.1145/3159450.3159539,0"Harrington, Brian and Cheng, Nick",Tracing vs. Writing Code: Beyond the Learning Hierarchy,2018,DSA: How CS1 relates to CS0 or CS2,http://doi.acm.org/10.1145/3159450.3159530,0"Alhazmi, Sohail and Hamilton, Margaret and Thevathayan, Charles",CS for All: Catering to Diversity of Master's Students Through Assignment Choices,2018,DSA: other,http://doi.acm.org/10.1145/3159450.3159464,0"Simon and Mason, Raina and Crick, Tom and Davenport, James H. and Murphy, Ellen",Language Choice in Introductory Programming Courses at Australasian and UK Universities,2018,FLP: general,http://doi.acm.org/10.1145/3159450.3159547,0"Alzahrani, Nabeel and Vahid, Frank and Edgcomb, Alex and Nguyen, Kevin and Lysecky, Roman",Python Versus C++: An Analysis of Student Struggle on Small Coding Exercises in Introductory Programming Courses,2018,FLP: specific text-based languages,http://doi.acm.org/10.1145/3159450.3160586,0"Ball, Robert and DuHadway, Linda and Hilton, Spencer and Rague, Brian",GUI-Based vs. Text-Based Assignments in CS1,2018,LA: assessment: general,http://doi.acm.org/10.1145/3159450.3159463,0"Zavala, Laura and Mendoza, Benito",On the Use of Semantic-Based AIG to Automatically Generate Programming Exercises,2018,LA: assessment: other: auto and student generated assignments,http://doi.acm.org/10.1145/3159450.3159608,0"Becker, Brett A. and Goslin, Kyle and Glanville, Graham",The Effects of Enhanced Compiler Error Messages on a Syntax Error Debugging Test,2018,LA: learning: errors,http://doi.acm.org/10.1145/3159450.3159461,0"Becker, Brett A. and Murray, Cormac and Tao, Tianyi and Song, Changheng and McCartney, Robert and Sanders, Kate","Fix the First, Ignore the Rest: Dealing with Multiple Compiler Error Messages",2018,LA: learning: errors,http://doi.acm.org/10.1145/3159450.3159453,1"Zingaro, Daniel and Craig, Michelle and Porter, Leo and Becker, Brett A. and Cao, Yingjun and Conrad, Phill and Cukierman, Diana and Hellas, Arto and Loksa, Dastyni and Thota, Neena",Achievement Goals in CS1: Replication and Extension,2018,LA: learning: learning styles,http://doi.acm.org/10.1145/3159450.3159452,0"Xie, Benjamin and Nelson, Greg L. and Ko, Andrew J.",An Explicit Strategy to Scaffold Novice Program Tracing,2018,LA: learning: reading or writing or tracing or debugging or testing,http://doi.acm.org/10.1145/3159450.3159527,0"Dawson, Jessica Q. and Allen, Meghan and Campbell, Alice and Valair, Anasazi",Designing an Introductory Programming Course to Improve Non-Majors' Experiences,2018,Students: non-majors,http://doi.acm.org/10.1145/3159450.3159548,0"Munson, Jonathan P. and Zitovsky, Joshua P.",Models for Early Identification of Struggling Novice Programmers,2018,Students: other: (attitudes self-efficacy at-risk),http://doi.acm.org/10.1145/3159450.3159476,0"Latulipe, Celine and Rorrer, Audrey and Long, Bruce",Longitudinal Data on Flipped Class Effects on Performance in CS1 and Retention After CS1,2018,Students: predicting and measuring success,http://doi.acm.org/10.1145/3159450.3159518,0"Wilcox, Chris and Lionelle, Albert",Quantifying the Benefits of Prior Programming Experience in an Introductory Computer Science Course,2018,Students: prior knowledge,http://doi.acm.org/10.1145/3159450.3159480,0"Lacher, Lisa L. and Jiang, Albert and Zhang, Yu and Lewis, Mark C.",Including Coding Questions in Video Quizzes for a Flipped CS1,2018,Teaching: flipped approaches,http://doi.acm.org/10.1145/3159450.3159504,0"Garcia, Saturnino",Improving Classroom Preparedness Using Guided Practice,2018,Teaching: other,http://doi.acm.org/10.1145/3159450.3159571,0"Caceffo, Ricardo and Gama, Guilherme and Azevedo, Rodolfo",Exploring Active Learning Approaches to Computer Science Classes,2018,Teaching: other,http://doi.acm.org/10.1145/3159450.3159585,0"Izu, Cruz and Mirolo, Claudio and Weerasinghe, Amali",Novice Programmers' Reasoning About Reversing Conditional Statements,2018,Teaching: specific topics (arrays recursion etc),http://doi.acm.org/10.1145/3159450.3159499,0"Esteero, Ramy and Khan, Mohammed and Mohamed, Mohamed and Zhang, Larry Yueli and Zingaro, Daniel",Recursion or Iteration: Does It Matter What Students Choose?,2018,Teaching: specific topics (arrays recursion etc),http://doi.acm.org/10.1145/3159450.3159455,0"Kumar, Amruth N.",Epplets: A Tool for Solving Parsons Puzzles,2018,Tools: other,http://doi.acm.org/10.1145/3159450.3159576,0"Ishizue, Ryosuke and Sakamoto, Kazunori and Washizaki, Hironori and Fukazawa, Yoshiaki",PVC: Visualizing C Programs on Web Browsers for Novices,2018,Tools: visualization,http://doi.acm.org/10.1145/3159450.3159566,0