Author,Title,Year,Category,Url,Citations"Fenwick,Jr., James B. and Norris, Cindy and Barry, Frank E. and Rountree, Josh and Spicer, Cole J. and Cheek, Scott D.",Another Look at the Behaviors of Novice Programmers,2009,Students: predicting and measuring success: programming process data,http://doi.acm.org/10.1145/1508865.1508973,15"Murphy, Christian and Kaiser, Gail and Loveland, Kristin and Hasan, Sahar",Retina: Helping Students and Instructors Based on Observed Programming Activities,2009,Students: predicting and measuring success: programming process data,http://doi.acm.org/10.1145/1508865.1508929,24"Barker, Lecia J. and McDowell, Charlie and Kalahar, Kimberly",Exploring Factors That Influence Computer Science Introductory Course Students to Persist in the Major,2009,Students: retention,http://doi.acm.org/10.1145/1508865.1508923,46"Bayliss, Jessica D.",Using Games in Introductory Courses: Tips from the Trenches,2009,Teaching: games,http://doi.acm.org/10.1145/1508865.1508989,14"Luxton-Reilly, Andrew and Denny, Paul",A Simple Framework for Interactive Games in CS1,2009,Teaching: games,http://doi.acm.org/10.1145/1508865.1508947,10"Eagle, Michael and Barnes, Tiffany",Experimental Evaluation of an Educational Game for Improved Learning in Introductory Computing,2009,Teaching: games,http://doi.acm.org/10.1145/1508865.1508980,29"Summet, Jay and Kumar, Deepak and O'Hara, Keith and Walker, Daniel and Ni, Lijun and Blank, Doug and Balch, Tucker",Personalizing CS1 with Robots,2009,Teaching: hardware (robots etc),http://doi.acm.org/10.1145/1508865.1509018,43"Lauwers, Tom and Nourbakhsh, Illah and Hamner, Emily",CSbots: Design and Deployment of a Robot Designed for the CS1 Classroom,2009,Teaching: hardware (robots etc),http://doi.acm.org/10.1145/1508865.1509017,15"McWhorter, William Isaac and O'Connor, Brian C.",Do LEGO\textregistered Mindstorms\textregistered Motivate Students in CS1?,2009,Teaching: hardware (robots etc),http://doi.acm.org/10.1145/1508865.1509019,18"Flatland, Robin Y. and Matthews, James R.",Using Modes of Inquiry and Engaging Problems to Link Computer Science and Mathematics,2009,Teaching: model problems and examples,http://doi.acm.org/10.1145/1508865.1509002,0"Bennett, Chris and Urness, Timothy",Using Daily Student Presentations to Address Attitudes and Communication Skills in CS1,2009,Teaching: other,http://doi.acm.org/10.1145/1508865.1508896,3"Goldwasser, Michael H. and Letscher, David",A Graphics Package for the First Day and Beyond,2009,Tools: libraries etc,http://doi.acm.org/10.1145/1508865.1508945,2"Boland, Michael G. and Clifton, Curtis",Introducing PyLighter: Dynamic Code Highlighter,2009,Tools: other,http://doi.acm.org/10.1145/1508865.1509037,0"Hundhausen, Christopher and Agrawal, Anukrati and Fairbrother, Dana and Trevisan, Michael",Does Studio-based Instruction Work in CS 1?: An Empirical Comparison with a Traditional Approach,2010,CA: other,http://doi.acm.org/10.1145/1734263.1734432,16"Braught, Grant and MacCormick, John and Wahls, Tim",The Benefits of Pairing by Ability,2010,CA: pair programming,http://doi.acm.org/10.1145/1734263.1734348,12"Simon, Beth and Kohanfars, Michael and Lee, Jeff and Tamayo, Karen and Cutts, Quintin",Experience Report: Peer Instruction in Introductory Computing,2010,CA: peer instruction,http://doi.acm.org/10.1145/1734263.1734381,43"Hundhausen, Christopher and Agrawal, Anukrati and Ryan, Kyle",The Design of an Online Environment to Support Pedagogical Code Reviews,2010,Content: software engineering approaches,http://doi.acm.org/10.1145/1734263.1734324,8"Bruce, Kim B. and Danyluk, Andrea and Murtagh, Thomas",Introducing Concurrency in CS 1,2010,Content: upper level topics in CS1,http://doi.acm.org/10.1145/1734263.1734341,13"Hertz, Matthew","What Do ""CS1"" and ""CS2"" Mean?: Investigating Differences in the Early Courses",2010,DSA: general,http://doi.acm.org/10.1145/1734263.1734335,14"Malan, David J.",Reinventing CS50,2010,DSA: general,http://doi.acm.org/10.1145/1734263.1734316,6"Enbody, Richard J. and Punch, William F.",Performance of Python CS1 Students in Mid-level Non-python CS Courses,2010,DSA: How CS1 relates to CS0 or CS2,http://doi.acm.org/10.1145/1734263.1734437,6"Ambr\'{o}sio, Ana Paula L. and Costa, F\'{a}bio M.",Evaluating the Impact of PBL and Tablet PCs in an Algorithms and Computer Programming Course,2010,DSA: other,http://doi.acm.org/10.1145/1734263.1734431,1"Denny, Paul and Hanks, Brian and Simon, Beth",Peerwise: Replication Study of a Student-collaborative Self-testing Web Service in a U.S. Setting,2010,LA: assessment: other: auto and student generated assignments,http://doi.acm.org/10.1145/1734263.1734407,9"Alvarado, Christine and Dodds, Zachary",Women in CS: An Evaluation of Three Promising Practices,2010,Students: gender diversity inclusion accessibililty,http://doi.acm.org/10.1145/1734263.1734281,28"Tew, Allison Elliott and Guzdial, Mark",Developing a Validated Assessment of Fundamental CS1 Concepts,2010,Students: prior knowledge: concept inventories; geek genes; misconceptions,http://doi.acm.org/10.1145/1734263.1734297,41"Kaczmarczyk, Lisa C. and Petrick, Elizabeth R. and East, J. Philip and Herman, Geoffrey L.",Identifying Student Misconceptions of Programming,2010,Students: prior knowledge: concept inventories; geek genes; misconceptions,http://doi.acm.org/10.1145/1734263.1734299,27"Cutts, Quintin and Cutts, Emily and Draper, Stephen and O'Donnell, Patrick and Saffrey, Peter",Manipulating Mindset to Positively Influence Introductory Programming Performance,2010,Students: retention,http://doi.acm.org/10.1145/1734263.1734409,14"Boyer, Kristy Elizabeth and Lahti, William and Phillips, Robert and Wallis, Michael D. and Vouk, Mladen A. and Lester, James C.",Principles of Asking Effective Questions During Student Problem Solving,2010,Teaching: aids examples tricks,http://doi.acm.org/10.1145/1734263.1734417,4"Schuster, Daniel L.","CS1, Arcade Games and the Free Java Book",2010,Teaching: games,http://doi.acm.org/10.1145/1734263.1734445,3"Hillyard, Cinnamon and Angotti, Robin and Panitz, Michael and Sung, Kelvin and Nordlinger, John and Goldstein, David",Game-themed Programming Assignments for Faculty: A Case Study,2010,Teaching: games,http://doi.acm.org/10.1145/1734263.1734358,6"Chavey, Darrah P.",Double Sorting: Testing Their Sorting Skills,2010,Teaching: model problems and examples,http://doi.acm.org/10.1145/1734263.1734392,0"Stepp, Michael and Simon, Beth",Introductory Computing Students' Conceptions of Illegal Student-student Collaboration,2010,Teaching: other: plagiarism,http://doi.acm.org/10.1145/1734263.1734365,6"Tenenbaum, Aaron and Weiss, Gerald and Arnow, David",Monetary Values: Double Trouble or Dollars and Sense?,2010,Teaching: specific topics (arrays recursion etc),http://doi.acm.org/10.1145/1734263.1734391,0"Carlisle, Martin C.",Using You Tube to Enhance Student Class Preparation in an Introductory Java Course,2010,Teaching: video,http://doi.acm.org/10.1145/1734263.1734419,5"Radermacher, Alex D. and Walia, Gursimran S.",Investigating the Effective Implementation of Pair Programming: An Empirical Investigation,2011,CA: pair programming,http://doi.acm.org/10.1145/1953163.1953346,4"Murphy, Christian and Powell, Rita and Parton, Kristen and Cannon, Adam",Lessons Learned from a PLTL-CS Program,2011,CA: peer instruction,http://doi.acm.org/10.1145/1953163.1953226,3"VanDeGrift, Tammy and Caruso, Tamara and Hill, Natalie and Simon, Beth",Experience Report: Getting Novice Programmers to THINK About Improving Their Software Development Process,2011,Content: software engineering approaches,http://doi.acm.org/10.1145/1953163.1953307,7"Garrity, Patrick and Yates, Timothy and Brown, Richard and Shoop, Elizabeth",WebMapReduce: An Accessible and Adaptable Tool for Teaching Map-reduce Computing,2011,Content: upper level topics in CS1,http://doi.acm.org/10.1145/1953163.1953221,16"Hundhausen, Christopher D. and Agarwal, Pawan and Trevisan, Michael",Online vs. Face-to-face Pedagogical Code Reviews: An Empirical Comparison,2011,"DSA PS: online, remote or MOOC delivery, DSA PS: online remote or MOOC delivery",http://doi.acm.org/10.1145/1953163.1953201,3"Jin, Wei and Corbett, Albert",Effectiveness of Cognitive Apprenticeship Learning (CAL) and Cognitive Tutors (CT) for Problem Solving Using Fundamental Programming Concepts,2011,LA: assessment: automatic tutoring and assessment systems,http://doi.acm.org/10.1145/1953163.1953254,3"Denny, Paul and Luxton-Reilly, Andrew and Tempero, Ewan and Hendrickx, Jacob",CodeWrite: Supporting Student-driven Practice of Java,2011,LA: assessment: automatic tutoring and assessment systems,http://doi.acm.org/10.1145/1953163.1953299,22"Petersen, Andrew and Craig, Michelle and Zingaro, Daniel",Reviewing CS1 Exam Question Content,2011,LA: assessment: exams,http://doi.acm.org/10.1145/1953163.1953340,32"Marceau, Guillaume and Fisler, Kathi and Krishnamurthi, Shriram",Measuring the Effectiveness of Error Messages Designed for Novice Programmers,2011,LA: learning: errors,http://doi.acm.org/10.1145/1953163.1953308,16"Cohoon, James P. and Tychonievich, Luther A.",Analysis of a CS1 Approach for Attracting Diverse and Inexperienced Students to Computing Majors,2011,Students: gender diversity inclusion accessibililty,http://doi.acm.org/10.1145/1953163.1953217,8"Dyke, Gregory",Which Aspects of Novice Programmers' Usage of an IDE Predict Learning Outcomes,2011,Students: predicting and measuring success: programming process data,http://doi.acm.org/10.1145/1953163.1953309,9"Tew, Allison Elliott and Guzdial, Mark",The FCS1: A Language Independent Assessment of CS1 Knowledge,2011,Students: prior knowledge: concept inventories; geek genes; misconceptions,http://doi.acm.org/10.1145/1953163.1953200,33"Shinners-Kennedy, Dermot and Barnes, David J.","The Novice Programmer's ""Device to Think with""",2011,Teaching: aids examples tricks,http://doi.acm.org/10.1145/1953163.1953310,0"Drake, Peter and Sung, Kelvin",Teaching Introductory Programming with Popular Board Games,2011,Teaching: games,http://doi.acm.org/10.1145/1953163.1953338,9"Davies, Stephen and Polack-Wahl, Jennifer A. and Anewalt, Karen",A Snapshot of Current Practices in Teaching the Introductory Programming Sequence,2011,Teaching: general,http://doi.acm.org/10.1145/1953163.1953339,13"Hubwieser, Peter and Berges, Marc",Minimally Invasive Programming Courses: Learning OOP with(out) Instruction,2011,Teaching: other,http://doi.acm.org/10.1145/1953163.1953195,5"Chamillard, A. T.",Using a Student Response System in CS1 and CS2,2011,Teaching: other,http://doi.acm.org/10.1145/1953163.1953253,5"Miller, L. D. and Soh, Leen-Kiat and Nugent, Gwen and Kupzyk, Kevin and Masmaliyeva, Leyla and Samal, Ashok",Evaluating the Use of Learning Objects in CS1,2011,Teaching: other,http://doi.acm.org/10.1145/1953163.1953183,0"Stone, Jeffrey A. and Clark, Tricia K.",The Impact of Problem-oriented Animated Learning Modules in a CS1-style Course,2011,Teaching: video,http://doi.acm.org/10.1145/1953163.1953182,2"Jenkins, Jam and Brannock, Evelyn and Cooper, Thomas and Dekhane, Sonal and Hall, Mark and Nguyen, Michael",Perspectives on Active Learning and Collaboration: JavaWIDE in the Classroom,2012,CA: other: collaborative tools,http://doi.acm.org/10.1145/2157136.2157194,4"Scaffidi, Christopher and Dahotre, Aniket and Zhang, Yan",How Well Do Online Forums Facilitate Discussion and Collaboration Among Novice Animation Programmers?,2012,CA: other: collaborative tools,http://doi.acm.org/10.1145/2157136.2157195,3"Radermacher, Alex and Walia, Gursimran and Rummelt, Richard",Assigning Student Programming Pairs Based on Their Mental Model Consistency: An Initial Investigation,2012,CA: pair programming,http://doi.acm.org/10.1145/2157136.2157236,4"Sprenkle, Sara and Duvall, Shannon",Reshaping the Image of Computer Science in Only Fifteen Minutes (of Class) a Week,2012,Content: other,http://doi.acm.org/10.1145/2157136.2157308,1"Haungs, Michael and Clark, Christopher and Clements, John and Janzen, David",Improving First-year Success and Retention Through Interest-based CS0 Courses,2012,DSA: How CS1 relates to CS0 or CS2,http://doi.acm.org/10.1145/2157136.2157307,18"Zingaro, Daniel and Petersen, Andrew and Craig, Michelle",Stepping Up to Integrative Questions on CS1 Exams,2012,LA: assessment: exams,http://doi.acm.org/10.1145/2157136.2157215,6"Gluga, Richard and Kay, Judy and Lister, Raymond and Kleitman, Sabina and Lever, Tim",Over-confidence and Confusion in Using Bloom for Programming Fundamentals Assessment,2012,LA: learning: conceptual or cognitive issues (load - mental models - notional machines),http://doi.acm.org/10.1145/2157136.2157181,9"Craig, Michelle and Petersen, Sarah and Petersen, Andrew",Following a Thread: Knitting Patterns and Program Tracing,2012,LA: learning: other,http://doi.acm.org/10.1145/2157136.2157204,4"Murphy, Laurie and McCauley, Ren{\'e}e and Fitzgerald, Sue",'Explain in Plain English' Questions: Implications for Teaching,2012,LA: learning: other,http://doi.acm.org/10.1145/2157136.2157249,10"Jamieson, Alan C. and Jamieson, Lindsay H. and Johnson, Angela C.",Application of Non-programming Focused Treisman-style Workshops in Introductory Computer Science,2012,Students: gender diversity inclusion accessibililty,http://doi.acm.org/10.1145/2157136.2157219,0"Piech, Chris and Sahami, Mehran and Koller, Daphne and Cooper, Steve and Blikstein, Paulo",Modeling How Students Learn to Program,2012,Students: predicting and measuring success,http://doi.acm.org/10.1145/2157136.2157182,40"Carter, Paul",An Experience Report: On the Use of Multimedia Pre-instruction and Just-in-time Teaching in a CS1 Course,2012,Teaching: other,http://doi.acm.org/10.1145/2157136.2157244,10"Stone, Jeffrey A.",Using Reflective Blogs for Pedagogical Feedback in CS1,2012,Teaching: other,http://doi.acm.org/10.1145/2157136.2157216,3"Greenberg, Ira and Kumar, Deepak and Xu, Dianna",Creative Coding and Visual Portfolios for CS1,2012,Teaching: other,http://doi.acm.org/10.1145/2157136.2157214,14"Vilner, Tamar and Zur, Ela and Sagi, Ronit",Integrating Video Components in CS1,2012,Teaching: video,http://doi.acm.org/10.1145/2157136.2157176,3"Blank, Douglas and Kay, Jennifer S. and Marshall, James B. and O'Hara, Keith and Russo, Mark","Calico: A Multi-programming-language, Multi-context Framework Designed for Computer Science Education",2012,Tools: editors apis etc,http://doi.acm.org/10.1145/2157136.2157158,2"Dewan, Prasun",How a Language-based GUI Generator Can Influence the Teaching of Object-oriented Programming,2012,Tools: visualization,http://doi.acm.org/10.1145/2157136.2157159,0"Zingaro, Daniel and Bailey Lee, Cynthia and Porter, Leo",Peer Instruction in Computing: The Role of Reading Quizzes,2013,CA: peer instruction,http://doi.acm.org/10.1145/2445196.2445216,14"Rebelsky, Samuel A. and Davis, Janet and Weinman, Jerod",Building Knowledge and Confidence with Mediascripting: A Successful Interdisciplinary Approach to CS1,2013,Content: other: media computation,http://doi.acm.org/10.1145/2445196.2445342,3"Ko, Yousun and Burgstaller, Bernd and Scholz, Bernhard",Parallel from the Beginning: The Case for Multicore Programming in Thecomputer Science Undergraduate Curriculum,2013,Content: upper level topics in CS1,http://doi.acm.org/10.1145/2445196.2445320,2"Pournaghshband, Vahab",Teaching the Security Mindset to CS1 Students,2013,Content: upper level topics in CS1,http://doi.acm.org/10.1145/2445196.2445299,1"Esper, Sarah and Foster, Stephen R. and Griswold, William G.",On the Nature of Fires and How to Spark Them when You'Re Not There,2013,DSA PS: other,http://doi.acm.org/10.1145/2445196.2445290,6"Black, Andrew P. and Bruce, Kim B. and Homer, Michael and Noble, James and Ruskin, Amy and Yannow, Richard",Seeking Grace: A New Object-oriented Language for Novices,2013,FLP: specific paradigms,http://doi.acm.org/10.1145/2445196.2445240,9"Razak, Saquib",A Case for Course Capstone Projects in CS1,2013,LA: assessment: other: projects,http://doi.acm.org/10.1145/2445196.2445398,1"Ginat, David and Shmalo, Ronit",Constructive Use of Errors in Teaching CS1,2013,LA: learning: errors,http://doi.acm.org/10.1145/2445196.2445300,4"Hertz, Matthew and Ford, Sarah Michele",Investigating Factors of Student Learning in Introductory Courses,2013,LA: learning: general learning,http://doi.acm.org/10.1145/2445196.2445254,2"Anderson, Nicole and Gegg-Harrison, Tim","Learning Computer Science in the ""Comfort Zone of Proximal Development""",2013,LA: learning: learning styles,http://doi.acm.org/10.1145/2445196.2445344,2"Lee, Cynthia Bailey","Experience Report: CS1 in MATLAB for Non-majors, with Media Computation and Peer Instruction",2013,Students: non-majors,http://doi.acm.org/10.1145/2445196.2445214,7"Lawrance, Joseph and Jung, Seikyung and Wiseman, Charles",Git on the Cloud in the Classroom,2013,Students: non-majors,http://doi.acm.org/10.1145/2445196.2445386,5"Sullivan, David G.",A Data-centric Introduction to Computer Science for Non-majors,2013,Students: non-majors,http://doi.acm.org/10.1145/2445196.2445222,12"Tafliovich, Anya and Campbell, Jennifer and Petersen, Andrew",A Student Perspective on Prior Experience in CS1,2013,Students: prior knowledge,http://doi.acm.org/10.1145/2445196.2445270,8"Porter, Leo and Simon, Beth",Retaining Nearly One-third More Majors with a Trio of Instructional Best Practices in CS1,2013,Students: retention,http://doi.acm.org/10.1145/2445196.2445248,51"Decker, Adrienne and Lawley, Elizabeth Lane",Life's a Game and the Game of Life: How Making a Game out of It Can Change Student Behavior,2013,Students: retention,http://doi.acm.org/10.1145/2445196.2445269,7"Hertz, Matthew and Jump, Maria",Trace-based Teaching in Early Programming Courses,2013,Teaching: aids examples tricks,http://doi.acm.org/10.1145/2445196.2445364,7"Lockwood, Kate and Esselstein, Rachel",The Inverted Classroom and the CS Curriculum,2013,Teaching: flipped approaches,http://doi.acm.org/10.1145/2445196.2445236,20"Rubin, Marc J.",The Effectiveness of Live-coding to Teach Introductory Programming,2013,Teaching: other,http://doi.acm.org/10.1145/2445196.2445388,10"Bayzick, Jennifer and Askins, Bradley and Kalafut, Sharon and Spear, Michael",Reading Mobile Games Throughout the Curriculum,2013,Tools: editors apis etc,http://doi.acm.org/10.1145/2445196.2445264,5"Zingaro, Daniel and Cherenkova, Yuliya and Karpova, Olessia and Petersen, Andrew",Facilitating Code-writing in PI Classes,2013,Tools: other,http://doi.acm.org/10.1145/2445196.2445369,15"Guo, Philip J.",Online Python Tutor: Embeddable Web-based Program Visualization for Cs Education,2013,Tools: visualization,http://doi.acm.org/10.1145/2445196.2445368,51"Hu, Helen H. and Shepherd, Tricia D.",Teaching CS 1 with POGIL Activities and Roles,2014,CA: other,http://doi.acm.org/10.1145/2538862.2538954,12"Zarb, Mark and Hughes, Janet and Richards, John",Evaluating Industry-inspired Pair Programming Communication Guidelines with Undergraduate Students,2014,CA: pair programming,http://doi.acm.org/10.1145/2538862.2538980,1"Zingaro, Daniel",Peer Instruction Contributes to Self-efficacy in CS1,2014,CA: peer instruction,http://doi.acm.org/10.1145/2538862.2538878,17"Warren, Joe and Rixner, Scott and Greiner, John and Wong, Stephen",Facilitating Human Interaction in an Online Programming Course,2014,"DSA PS: online, remote or MOOC delivery, DSA PS: online remote or MOOC delivery",http://doi.acm.org/10.1145/2538862.2538893,5"Bart, Austin Cory and Tilevich, Eli and Hall, Simin and Allevato, Tony and Shaffer, Clifford A.",Transforming Introductory Computer Science Projects via Real-time Web Data,2014,LA: assessment: authentic assessment,http://doi.acm.org/10.1145/2538862.2538941,6"Gaudencio, Matheus and Dantas, Ayla and Guerrero, Dalton D.S.",Can Computers Compare Student Code Solutions As Well As Teachers?,2014,LA: assessment: automatic tutoring and assessment systems,http://doi.acm.org/10.1145/2538862.2538973,3"Moreno, Andr{\'e}s and Sutinen, Erkki and Joy, Mike",Defining and Evaluating Conflictive Animations for Programming Education: The Case of Jeliot ConAn,2014,LA: learning: errors,http://doi.acm.org/10.1145/2538862.2538888,1"DeNero, John and Martinis, Stephen",Teaching Composition Quality at Scale: Human Judgment in the Age of Autograders,2014,LA: learning: reading or writing or tracing or debugging or testing,http://doi.acm.org/10.1145/2538862.2538976,2"Charters, Polina and Lee, Michael J. and Ko, Andrew J. and Loksa, Dastyni",Challenging Stereotypes and Changing Attitudes: The Effect of a Brief Programming Encounter on Adults' Attitudes Toward Programming,2014,Students: gender diversity inclusion accessibililty,http://doi.acm.org/10.1145/2538862.2538938,8"Davis, Don and Yuen, Timothy and Berland, Matthew",Multiple Case Study of Nerd Identity in a CS1 Class,2014,Students: gender diversity inclusion accessibililty,http://doi.acm.org/10.1145/2538862.2538960,2"Kane, Shaun K. and Bigham, Jeffrey P.","Tracking @Stemxcomet: Teaching Programming to Blind Students via 3D Printing, Crisis Management, and Twitter",2014,Students: gender diversity inclusion accessibililty,http://doi.acm.org/10.1145/2538862.2538975,17"Collier, Robert Don and Kawash, Jalal",Lessons Learned and Recommended Strategies for Game Development Components in a Computer Literacy Course,2014,Students: non-majors,http://doi.acm.org/10.1145/2538862.2538887,0"Cherenkova, Yuliya and Zingaro, Daniel and Petersen, Andrew",Identifying Challenging CS1 Concepts in a Large Problem Dataset,2014,Students: predicting and measuring success,http://doi.acm.org/10.1145/2538862.2538966,10"Porter, Leo and Zingaro, Daniel",Importance of Early Performance in CS1: Two Conflicting Assessment Stories,2014,Students: predicting and measuring success,http://doi.acm.org/10.1145/2538862.2538912,8"Alvarado, Christine and Lee, Cynthia Bailey and Gillespie, Gary","New CS1 Pedagogies and Curriculum, the Same Success Factors?",2014,Students: predicting and measuring success,http://doi.acm.org/10.1145/2538862.2538897,8"Watson, Christopher and Li, Frederick W.B. and Godwin, Jamie L.",No Tests Required: Comparing Traditional and Dynamic Predictors of Programming Success,2014,Students: predicting and measuring success,http://doi.acm.org/10.1145/2538862.2538930,36"Heinonen, Kenny and Hirvikoski, Kasper and Luukkainen, Matti and Vihavainen, Arto",Using CodeBrowser to Seek Differences Between Novice Programmers,2014,Students: predicting and measuring success: programming process data,http://doi.acm.org/10.1145/2538862.2538981,4"Brown, Neil Christopher Charles and K\""{o}lling, Michael and McCall, Davin and Utting, Ian",Blackbox: A Large Scale Repository of Novice Programmers' Activity,2014,Students: predicting and measuring success: programming process data,http://doi.acm.org/10.1145/2538862.2538924,18"Campbell, Jennifer and Horton, Diane and Craig, Michelle and Gries, Paul",Evaluating an Inverted CS1,2014,Teaching: flipped approaches,http://doi.acm.org/10.1145/2538862.2538943,14"Sanford, Joseph P. and Tietz, Aaron and Farooq, Saad and Guyer, Samuel and Shapiro, R. Benjamin",Metaphors We Teach by,2014,Teaching: other,http://doi.acm.org/10.1145/2538862.2538945,4"Miller, L. D. and Soh, Leen-Kiat and Chiriacescu, Vlad and Ingraham, Elizabeth and Shell, Duane F. and Hazley, Melissa Patterson",Integrating Computational and Creative Thinking to Improve Learning and Performance in CS1,2014,Teaching: other: computational thinking,http://doi.acm.org/10.1145/2538862.2538940,8"Newhall, Tia and Meeden, Lisa and Danner, Andrew and Soni, Ameet and Ruiz, Frances and Wicentowski, Richard",A Support Program for Introductory CS Courses That Improves Student Performance and Retains Students from Underrepresented Groups,2014,Teaching: other: teaching assistants and mentors,http://doi.acm.org/10.1145/2538862.2538923,11"Tang, Terry and Rixner, Scott and Warren, Joe",An Environment for Learning Interactive Programming,2014,Tools: editors apis etc,http://doi.acm.org/10.1145/2538862.2538908,4"Edwards, Stephen H. and Tilden, Daniel S. and Allevato, Anthony",Pythy: Improving the Introductory Python Programming Experience,2014,Tools: editors apis etc,http://doi.acm.org/10.1145/2538862.2538977,2"Ilinkin, Ivaylo",Opportunities for Android Projects in a CS1 Course,2014,Tools: other,http://doi.acm.org/10.1145/2538862.2538983,3"Cross, James and Hendrix, Dean and Barowski, Larry and Umphress, David",Dynamic Program Visualizations: An Experience Report,2014,Tools: visualization,http://doi.acm.org/10.1145/2538862.2538958,3"Zarb, Mark and Hughes, Janet and Richards, John",Further Evaluations of Industry-Inspired Pair Programming Communication Guidelines with Undergraduate Students,2015,CA: pair programming,http://doi.acm.org/10.1145/2676723.2677241,1"Anderson, Ruth E. and Ernst, Michael D. and Ord\'{o}\~{n}ez, Robert and Pham, Paul and Tribelhorn, Ben",A Data Programming CS1 Course,2015,Content: other: data science approach,http://doi.acm.org/10.1145/2676723.2677309,10"Hall-Holt, Olaf A. and Sanft, Kevin R.",Statistics-infused Introduction to Computer Science,2015,Content: other: data science approach,http://doi.acm.org/10.1145/2676723.2677218,3"Matsuzawa, Yoshiaki and Ohata, Takashi and Sugiura, Manabu and Sakai, Sanshiro",Language Migration in non-CS Introductory Programming Through Mutual Language Translation Environment,2015,FLP: other: language agnostic approaches,http://doi.acm.org/10.1145/2676723.2677230,6"Wilcox, Chris",The Role of Automation in Undergraduate Computer Science Education,2015,LA: assessment: automatic tutoring and assessment systems,http://doi.acm.org/10.1145/2676723.2677226,4